{
 "schema": "longevity-biovar/1",
 "z": 1.96,
 "default_cva_rule_zh": "化验机构没有给出分析变异（CVA）时，按 EFLM 期望分析性能取 CVA = 0.5 × CVI（Sandberg 等，CCLM 2024;62:1483-9）。血压和体重的变异已包含测量误差，CVA 取 0。",
 "sources_note_zh": [
  "化验项目的个体内变异（CVI）都来自期刊论文，每一行的 cvi_source.quote 是原文里印着这个数的句子或表格行：EuBIVAS 汇总报告（Carobene 等，CCLM 2022）和它的原始论文（肌酐、酶类），EFLM 生物变异工作组发表的血液学 meta 分析（Coskun 等，CCLM 2020）和 HbA1c meta 分析（Ricós 等，Adv Lab Med 2020，CC BY 4.0），以及 25(OH)D 研究（Cavalier 等，Nutrients 2021，CC BY 4.0）。lsk check 会检查每个数都出现在引文里。",
  "本表不收录 EFLM 生物变异数据库（biologicalvariation.eu）里的数值：该数据库的条款限制未经许可的再发布。",
  "淋巴细胞百分比和 RDW-CV 没有找到可核对的个体内变异估计（已发表的是淋巴细胞绝对计数和 RDW-SD；淋巴细胞绝对计数单列为 lymph_abs），所以不在表里；表型年龄的噪声带因此不含这两项，是下限。",
  "血压和体重来自同行评审研究，测量误差已经包含在内，见各行来源。"
 ],
 "markers": [
  {
   "key": "albumin",
   "label_zh": "白蛋白",
   "loinc": [
    "1751-7"
   ],
   "aliases": [
    "ALB",
    "albumin",
    "血清白蛋白"
   ],
   "unit": "g/L",
   "cvi_pct": 2.5,
   "cvi_ci_pct": [
    2.4,
    2.7
   ],
   "cva_pct": null,
   "log_normal": false,
   "better": "range",
   "min_retest_days": null,
   "cvi_source": {
    "title": "Carobene A et al. The European Biological Variation Study (EuBIVAS): a summary report. Clin Chem Lab Med 2022;60(4):505-17",
    "url": "https://doi.org/10.1515/cclm-2021-0370",
    "doi": "10.1515/cclm-2021-0370",
    "note": "EuBIVAS: 91 healthy adults (21-69 y) at 6 European centres, fasting samples weekly for 10 weeks, each person's samples run in duplicate in one run; CVI by CV-ANOVA with 95% CI. The quote is the Table 2 row (measurand, n (M/F), results, mean, CVA, CVI, CVG). Albumin: 90 people, mean 42.1 g/L.",
    "quote": "33 | Alb, g/L | 90 (38/52) | 1,675 | 42.1 (41.9–42.2) | 1.50 (1.4–1.6) | 2.5 (2.4–2.7) | 5.1 (4.4–5.9)",
    "quote_location": "Table 2 row 33",
    "license": "free to read at the publisher, no Creative Commons licence"
   },
   "verified": true
  },
  {
   "key": "creatinine",
   "label_zh": "肌酐",
   "loinc": [
    "2160-0",
    "14682-9"
   ],
   "aliases": [
    "Cr",
    "CREA",
    "creatinine",
    "肌酐(Cr)"
   ],
   "unit": "umol/L",
   "cvi_pct": 4.4,
   "cvi_ci_pct": [
    4.2,
    4.7
   ],
   "cva_pct": null,
   "log_normal": false,
   "better": "range",
   "min_retest_days": null,
   "convert": {
    "mg/dL": 88.4
   },
   "cvi_source": {
    "title": "Carobene A et al. The EuBIVAS Project: within- and between-subject biological variation data for serum creatinine using enzymatic and alkaline picrate methods. Clin Chem 2017;63(9):1527-36",
    "url": "https://pubmed.ncbi.nlm.nih.gov/28720681/",
    "doi": "10.1373/clinchem.2017.275115",
    "note": "91 healthy adults, weekly for 10 weeks. Enzymatic method used here; alkaline picrate (Jaffe) gave 4.7% (4.4-4.9).",
    "quote": "The within-subject BV estimates [CVI (95% CI)] were similar for enzymatic [4.4% (4.2-4.7)] and alkaline picrate [4.7% (4.4-4.9)] methods and lower than the estimate presently available online (CVI = 5.9%).",
    "quote_location": "abstract",
    "license": "abstract free on PubMed"
   },
   "verified": true
  },
  {
   "key": "glucose",
   "label_zh": "空腹血糖",
   "loinc": [
    "14771-0",
    "2345-7",
    "1558-6",
    "14749-6"
   ],
   "aliases": [
    "FBG",
    "GLU",
    "FPG",
    "glucose",
    "葡萄糖",
    "空腹葡萄糖",
    "血糖"
   ],
   "unit": "mmol/L",
   "cvi_pct": 4.7,
   "cvi_ci_pct": [
    4.4,
    4.9
   ],
   "cva_pct": null,
   "log_normal": false,
   "better": "lower",
   "min_retest_days": null,
   "retest_note_zh": "ADA 没有给出干预后的复测间隔；异常结果应尽快复查确认。",
   "retest_source": {
    "title": "ADA Standards of Care in Diabetes 2026, Section 2",
    "url": "https://pmc.ncbi.nlm.nih.gov/articles/PMC12690183/",
    "doi": "10.2337/dc26-S002"
   },
   "convert": {
    "mg/dL": 0.0555
   },
   "cvi_source": {
    "title": "Carobene A et al. The European Biological Variation Study (EuBIVAS): a summary report. Clin Chem Lab Med 2022;60(4):505-17",
    "url": "https://doi.org/10.1515/cclm-2021-0370",
    "doi": "10.1515/cclm-2021-0370",
    "note": "EuBIVAS: 91 healthy adults (21-69 y) at 6 European centres, fasting samples weekly for 10 weeks, each person's samples run in duplicate in one run; CVI by CV-ANOVA with 95% CI. The quote is the Table 2 row (measurand, n (M/F), results, mean, CVA, CVI, CVG). Serum glucose: 89 people, mean 4.58 mmol/L.",
    "quote": "21 | Glu, mmol/L | 89 (38/51) | 1,658 | 4.58 (4.55–4.60) | 0.58 (0.56–0.61) | 4.7 (4.4–4.9) | 8.1 (7.1–9.7)",
    "quote_location": "Table 2 row 21",
    "license": "free to read at the publisher, no Creative Commons licence"
   },
   "verified": true
  },
  {
   "key": "crp",
   "label_zh": "超敏C反应蛋白",
   "loinc": [
    "30522-7",
    "1988-5"
   ],
   "aliases": [
    "hs-CRP",
    "hsCRP",
    "CRP",
    "C反应蛋白",
    "超敏CRP",
    "C-反应蛋白"
   ],
   "unit": "mg/L",
   "cvi_pct": 29.4,
   "cvi_ci_pct": [
    27.6,
    31.1
   ],
   "cva_pct": null,
   "log_normal": true,
   "better": "lower",
   "min_retest_days": 14,
   "retest_note_zh": "AHA/CDC：两次测量取平均、最好相隔两周；超过 10 mg/L 要两周后复测并排查感染或炎症。这是基线评估的做法，不是干预后的复测间隔。",
   "retest_source": {
    "title": "AHA/CDC scientific statement on markers of inflammation (Pearson et al., Circulation 2003;107:499-511)",
    "url": "https://doi.org/10.1161/01.CIR.0000052939.59093.45",
    "doi": "10.1161/01.CIR.0000052939.59093.45"
   },
   "convert": {
    "mg/dL": 10
   },
   "cvi_source": {
    "title": "Carobene A et al. The European Biological Variation Study (EuBIVAS): a summary report. Clin Chem Lab Med 2022;60(4):505-17",
    "url": "https://doi.org/10.1515/cclm-2021-0370",
    "doi": "10.1515/cclm-2021-0370",
    "note": "EuBIVAS: 91 healthy adults (21-69 y) at 6 European centres, fasting samples weekly for 10 weeks, each person's samples run in duplicate in one run; CVI by CV-ANOVA with 95% CI. The quote is the Table 2 row (measurand, n (M/F), results, mean, CVA, CVI, CVG). CRP: 87 people, mean 0.72 mg/L (the high-sensitivity range), after excluding results from mild inflammatory episodes.",
    "quote": "45 | CRP, mg/L | 87 (37/50) | 1,423 | 0.72 (0.68–0.76) | 11.10 (10.5–11.7) | 29.4 (27.6–31.1) | 87.0 (72.6–109.6)",
    "quote_location": "Table 2 row 45",
    "license": "free to read at the publisher, no Creative Commons licence"
   },
   "verified": true,
   "caveat_zh": "这个变异是在剔除轻微炎症期之后算的；研究期间约四分之一的人有过至少一次。感冒、受伤后测的 CRP 会大得多，所以超过 10 mg/L 的结果要两周后复测，不参与判断。"
  },
  {
   "key": "mcv",
   "label_zh": "平均红细胞体积",
   "loinc": [
    "787-2"
   ],
   "aliases": [
    "MCV"
   ],
   "unit": "fL",
   "cvi_pct": 0.75,
   "cvi_ci_pct": [
    0.64,
    1.17
   ],
   "cva_pct": null,
   "log_normal": false,
   "better": "range",
   "min_retest_days": null,
   "cvi_source": {
    "title": "Coskun A et al. Systematic review and meta-analysis of within-subject and between-subject biological variation estimates of 20 haematological parameters. Clin Chem Lab Med 2020;58(1):25-32",
    "url": "https://doi.org/10.1515/cclm-2019-0658",
    "doi": "10.1515/cclm-2019-0658",
    "note": "Meta-analysis of BIVAC-graded studies in healthy adults (7 papers, 12 subgroups). The quote is the Table 2 row (papers, subgroups, mean, CVI (CI), ...).",
    "quote": "MCV, fL | 7 | 12 | 88.4 ± 2.37 | 0.75 (0.64–1.17) | 6 | 11 | 88.0 ± 2.10 | 3.78 (3.40–4.68) | 1.40 | 4.85",
    "quote_location": "Table 2 row",
    "license": "free to read at the publisher, no Creative Commons licence"
   },
   "verified": true,
   "caveat_zh": "MCV 的个体内变异非常小，仪器误差可能和它一样大；按默认规则估的检测误差偏小，噪声带可能偏窄。"
  },
  {
   "key": "rbc",
   "label_zh": "红细胞计数",
   "loinc": [
    "789-8"
   ],
   "aliases": [
    "RBC",
    "红细胞数"
   ],
   "unit": "10^12/L",
   "cvi_pct": 2.8,
   "cvi_ci_pct": [
    1.96,
    3.07
   ],
   "cva_pct": null,
   "log_normal": false,
   "better": "range",
   "min_retest_days": null,
   "cvi_source": {
    "title": "Coskun A et al. Systematic review and meta-analysis of within-subject and between-subject biological variation estimates of 20 haematological parameters. Clin Chem Lab Med 2020;58(1):25-32",
    "url": "https://doi.org/10.1515/cclm-2019-0658",
    "doi": "10.1515/cclm-2019-0658",
    "note": "Meta-analysis of BIVAC-graded studies in healthy adults (7 papers, 12 subgroups), men and women pooled. The quote is the Table 2 row (papers, subgroups, mean, CVI (CI), ...).",
    "quote": "Erythrocyte, ×10¹²/L | 7 | 12 | 4.82 ± 0.33 | 2.80 (1.96–3.07) | 5 | 10 | 4.85 ± 0.36 | 6.29 (6.16–7.40) | 3.20 | 6.30",
    "quote_location": "Table 2 row",
    "license": "free to read at the publisher, no Creative Commons licence"
   },
   "verified": true
  },
  {
   "key": "hb",
   "label_zh": "血红蛋白",
   "loinc": [
    "718-7"
   ],
   "aliases": [
    "HGB",
    "Hb",
    "血红蛋白浓度"
   ],
   "unit": "g/L",
   "cvi_pct": 2.71,
   "cvi_ci_pct": [
    1.72,
    2.8
   ],
   "cva_pct": null,
   "log_normal": false,
   "better": "range",
   "min_retest_days": null,
   "convert": {
    "g/dL": 10
   },
   "cvi_source": {
    "title": "Coskun A et al. Systematic review and meta-analysis of within-subject and between-subject biological variation estimates of 20 haematological parameters. Clin Chem Lab Med 2020;58(1):25-32",
    "url": "https://doi.org/10.1515/cclm-2019-0658",
    "doi": "10.1515/cclm-2019-0658",
    "note": "Meta-analysis of BIVAC-graded studies in healthy adults (11 papers, 21 subgroups), men and women pooled. The quote is the Table 2 row (papers, subgroups, mean, CVI (CI), ...). Table 2 prints haemoglobin in mmol/L; a CV is unitless, so the CVI holds for g/L.",
    "quote": "Haemoglobin, mmol/L | 11 | 21 | 8.77 ± 0.61 | 2.71 (1.72–2.80) | 6 | 13 | 8.72 ± 0.63 | 6.07 (3.20–6.28) | 2.85 | 6.80",
    "quote_location": "Table 2 row",
    "license": "free to read at the publisher, no Creative Commons licence"
   },
   "verified": true
  },
  {
   "key": "hct",
   "label_zh": "红细胞压积",
   "loinc": [
    "4544-3"
   ],
   "aliases": [
    "HCT",
    "血细胞比容",
    "红细胞比容"
   ],
   "unit": "L/L",
   "cvi_pct": 2.71,
   "cvi_ci_pct": [
    2.24,
    3.4
   ],
   "cva_pct": null,
   "log_normal": false,